{
  "schemaVersion": "0.1",
  "gameVersion": "2",
  "id": "fixture-two-round",
  "title": "Two-round fixture",
  "tagline": "A compact engine verification run.",
  "organSystem": "respiratory",
  "estimatedSeconds": 90,
  "slots": [
    {
      "id": "warmup",
      "pool": ["fixture-warmup-call"],
      "pick": 1
    },
    {
      "id": "clinical",
      "pool": ["clinical-call-t2"],
      "pick": 1
    }
  ],
  "difficulties": ["warmup", "challenge", "expert"],
  "defaultDifficulty": "challenge",
  "durationWindowSeconds": {
    "min": 60,
    "max": 150
  }
}
