{
  "schemaVersion": "0.1",
  "gameVersion": "1",
  "id": "fixture-one-round",
  "title": "Clinical call fixture",
  "tagline": "One clinical decision.",
  "organSystem": "respiratory",
  "estimatedSeconds": 75,
  "slots": [
    {
      "id": "clinical",
      "pool": ["clinical-call-t2"],
      "pick": 1
    }
  ],
  "difficulties": ["warmup", "challenge", "expert"],
  "defaultDifficulty": "challenge",
  "durationWindowSeconds": {
    "min": 45,
    "max": 90
  }
}
